{
  "profile": "ZTCS01-proposal",
  "synthetic": true,
  "account_hex": "01010101010101010101010101010101",
  "contact_hex": "0b0b0b0b0b0b0b0b0b0b0b0b0b0b0b0b",
  "records": [
    {
      "state": "present",
      "contact_hex": "0b0b0b0b0b0b0b0b0b0b0b0b0b0b0b0b",
      "revision": "2",
      "mutation_hex": "5a54434d0102010101010101010101010101010101010b0b0b0b0b0b0b0b0b0b0b0b0b0b0b0b000000000000000100000000000000020d0d0d0d0d0d0d0d0d0d0d0d0d0d0d0da2ebd49e24082a3d2ef3eba023378893a1cd80c5411fe9ef27016f9d132e065c00000000000000010000000000000008aab0c543c5f7179aeb59e7b24dad893c3906109756f324157bf24624098bb550c1d0eb147750dec278bac9889debe5df45f70164e69a9e47c8f7863b83ae06c4bfb65de6e0f430140757d752965feeb68271d9705b29802200b78e91a420db8d0000000000000000010000000000000001fb5dbfd5932c4324ab510d990696a89a0a97c89a896bceb4e7b596d60a90b921010000000000000002a718d930f9cfda044bb61de13ec2d26e2eabd0b5e30b5dcd13b17f79e887058f7ff1c98bc109b748de00610d87b31d6de0a7225d8695e1d3f23ba3ea1c51503f016a429f6779c97a96577dcefe281353bf6fa26c23773c25d7c1e011c81f0a2a",
      "name_field_hex": "5a54434f0101010101010101010101010101010101010b0b0b0b0b0b0b0b0b0b0b0b0b0b0b0b0000000000000001000000000000000100000000000000070000000000000001a7f5fac9ffbf8b4528c8cc22c33b6aaa953bcc41110ccbf6ca96b57e6a6241d18ddb1fefed2291fc2c1655f08622deaa59ca89eee9ce4d6030eccb4c877afc7b3b1a11d1a86a359ebf212abf06337e5a529a412e1d29293438841ce9adc63781bfb65de6e0f430140757d752965feeb68271d9705b29802200b78e91a420db8d0c0c0c0c0c0c0c0c0c0c0c0c0c0c0c0cb0d8345f27248e9485b6ab3aeb3d458b6786ee54fa3650613829964e79446587041678085d2be9263aa4d410a5bcd242cdd0a4b9a2845e9795b67464318311b4ab61aeee552418e418bd491d14770d5072a9ad7c5651a04f37c9614fecb8343ad2000000177a6e1c278cf03abb5049fabddd27957bb8382edc032bfb344de14d3a1020db3c12c46e3bd5a3385814f41cf32f46d64655f6989a38ba661290251fe484d5837d8ea3560d57d4786c042b428f8b64fc9c72e8f23c9c7694",
      "notes_field_hex": "5a54434f0102010101010101010101010101010101010b0b0b0b0b0b0b0b0b0b0b0b0b0b0b0b0000000000000002000000000000000100000000000000080000000000000002a4a9d80338f8f3128dcffa19dc03c4f41421168052512861b6b0074046eea403aab0c543c5f7179aeb59e7b24dad893c3906109756f324157bf24624098bb550c1d0eb147750dec278bac9889debe5df45f70164e69a9e47c8f7863b83ae06c4bfb65de6e0f430140757d752965feeb68271d9705b29802200b78e91a420db8d0d0d0d0d0d0d0d0d0d0d0d0d0d0d0d0db0d8345f27248e9485b6ab3aeb3d458b6786ee54fa3650613829964e794465870446116cbf8dbcce8060c0050c177a79b2fe1b8993228e9107be7e5a98424a61802a464fccada3dface563d10ede2c45103bd997ed2587cc86d6bfcee123ed2cb500000015fe07a95d3c72bd1c9fb3a3b2ae2221e20867971285eedcd1eb5923ea5149ae936b14f20f1581a8c96cef6a90bf58f5022080706fac4127aef3acc1939073c0f5c39a581bb4ac7ec5e5e1d48c68e1786aa206ac9008"
    },
    {
      "state": "present",
      "contact_hex": "0b0b0b0b0b0b0b0b0b0b0b0b0b0b0b0b",
      "revision": "3",
      "mutation_hex": "5a54434d0102010101010101010101010101010101010b0b0b0b0b0b0b0b0b0b0b0b0b0b0b0b000000000000000200000000000000030e0e0e0e0e0e0e0e0e0e0e0e0e0e0e0eb770cfd8ab90368ff47fb6125f093f629b71ea42ddf21fa499cee21a9e6f488300000000000000010000000000000008aab0c543c5f7179aeb59e7b24dad893c3906109756f324157bf24624098bb550c1d0eb147750dec278bac9889debe5df45f70164e69a9e47c8f7863b83ae06c4bfb65de6e0f430140757d752965feeb68271d9705b29802200b78e91a420db8d00000000000000000000000000000000000000000000000000000000000000000000000000000000000000000000000000010000000000000002a718d930f9cfda044bb61de13ec2d26e2eabd0b5e30b5dcd13b17f79e887058fda831b2dce9f79e6e9e343e1cb43f9646ee2104db45d5e0df63f31d16a498a4c1bbeb0af1eec7e2a2c84a1d8ff236d97aef635e3ccd984229056e736e2b3e09d",
      "name_field_hex": null,
      "notes_field_hex": "5a54434f0102010101010101010101010101010101010b0b0b0b0b0b0b0b0b0b0b0b0b0b0b0b0000000000000002000000000000000100000000000000080000000000000002a4a9d80338f8f3128dcffa19dc03c4f41421168052512861b6b0074046eea403aab0c543c5f7179aeb59e7b24dad893c3906109756f324157bf24624098bb550c1d0eb147750dec278bac9889debe5df45f70164e69a9e47c8f7863b83ae06c4bfb65de6e0f430140757d752965feeb68271d9705b29802200b78e91a420db8d0d0d0d0d0d0d0d0d0d0d0d0d0d0d0d0db0d8345f27248e9485b6ab3aeb3d458b6786ee54fa3650613829964e794465870446116cbf8dbcce8060c0050c177a79b2fe1b8993228e9107be7e5a98424a61802a464fccada3dface563d10ede2c45103bd997ed2587cc86d6bfcee123ed2cb500000015fe07a95d3c72bd1c9fb3a3b2ae2221e20867971285eedcd1eb5923ea5149ae936b14f20f1581a8c96cef6a90bf58f5022080706fac4127aef3acc1939073c0f5c39a581bb4ac7ec5e5e1d48c68e1786aa206ac9008"
    },
    {
      "state": "deleted",
      "contact_hex": "0b0b0b0b0b0b0b0b0b0b0b0b0b0b0b0b",
      "final_revision": "3",
      "last_mutation_digest_hex": "357ab5d24168c6ed82a75ffb49c43ad955a213dc7b005f8a6d8a10efabdd8373"
    }
  ]
}
